<?xml version="1.0" encoding="UTF-8"?>
<!DOCTYPE BlockLangDef SYSTEM "lang_def.dtd">

<!-- 
This describes every BlockGenus, BlockDrawer, BlockFamilies in Starlogo-TNG.

Note: For BlockGenus, if genus A relies on another genus B, that genus B must be 
specified in the xml file before genus A is specified.  We impose this requirement so 
that sanity checks can be made regarding the validity of a default argument when the
BlockGenuses are first loaded. 
-->

<BlockLangDef>

	<BlockConnectorShapes>
		<BlockConnectorShape shape-type="number" shape-number="1"></BlockConnectorShape>
		<BlockConnectorShape shape-type="number-list" shape-number="2"></BlockConnectorShape>
		<BlockConnectorShape shape-type="number-inv" shape-number="3"></BlockConnectorShape>
		<BlockConnectorShape shape-type="boolean" shape-number="4"></BlockConnectorShape>
		<BlockConnectorShape shape-type="boolean-list" shape-number="5"></BlockConnectorShape>
		<BlockConnectorShape shape-type="boolean-inv" shape-number="6"></BlockConnectorShape>
		<BlockConnectorShape shape-type="string" shape-number="7"></BlockConnectorShape>
		<BlockConnectorShape shape-type="string-list" shape-number="8"></BlockConnectorShape>
		<BlockConnectorShape shape-type="string-inv" shape-number="9"></BlockConnectorShape>
		<BlockConnectorShape shape-type="poly" shape-number="10"></BlockConnectorShape>
		<BlockConnectorShape shape-type="poly-list" shape-number="11"></BlockConnectorShape>
		<BlockConnectorShape shape-type="poly-inv" shape-number="12"></BlockConnectorShape>
		<BlockConnectorShape shape-type="proc-param" shape-number="13"></BlockConnectorShape>
		<BlockConnectorShape shape-type="cmd" shape-number="14"></BlockConnectorShape>
	</BlockConnectorShapes>

	<BlockGenuses>
		<!-- Stub Genuses 
		Do not remove unless you would like to remove the stub feature all together
		-->

		<BlockGenus name="getter" kind="data" initlabel="" color="0 0 0" >
			<description>
				<text>
					Reports the value of the variable.
				</text>
			</description>
			<BlockConnectors>
				<BlockConnector connector-kind="plug" connector-type="poly" position-type="mirror"></BlockConnector>
			</BlockConnectors>
			<LangSpecProperties>
				<LangSpecProperty key="is-monitorable" value="yes"></LangSpecProperty>
			</LangSpecProperties>	
		</BlockGenus>

		<BlockGenus name="setter" kind="command" initlabel="" color="0 0 0" label-prefix="set ">
			<description>
				<text>
					Sets the value of the variable.
				</text>
			</description>
			<BlockConnectors>
				<BlockConnector connector-kind="socket" connector-type="poly" position-type="single"></BlockConnector>
			</BlockConnectors>
		</BlockGenus>

		<BlockGenus name="caller" kind="command" initlabel="" color="0 0 0">
			<description>
				<text>
					Calls the procedure of the specified name.
				</text>
			</description>
		</BlockGenus>

		<BlockGenus name="inc" kind="command" initlabel="" color="0 0 0" label-prefix="inc ">
			<description>
				<text>
					Increments the value of the variable number.
				</text>
			</description>
			<BlockConnectors>
				<BlockConnector connector-kind="socket" connector-type="number" position-type="single"></BlockConnector>
			</BlockConnectors>		
		</BlockGenus>

		<BlockGenus name="agent" kind="function" initlabel="" color="0 0 0" label-suffix=" of" is-starter="yes" is-terminator="yes">
			<description>
				<text>
					Gets the value of the variable of the agent ID.
				</text>
			</description>
			<BlockConnectors>
				<BlockConnector connector-kind="plug" connector-type="poly" position-type="single"></BlockConnector>
				<BlockConnector label="ID" connector-kind="socket" connector-type="number" position-type="single"></BlockConnector>
			</BlockConnectors>	
			<LangSpecProperties>
				<LangSpecProperty key="is-monitorable" value="yes"></LangSpecProperty>
			</LangSpecProperties>			
		</BlockGenus>

		<!-- End of Stub Genuses -->

		<BlockGenus name="number" kind="data" initlabel="1" editable-label="yes" is-label-value="yes" color="255 0 255">
			<description>
				<text>
					Reports the number shown.
				</text>
			</description>
			<BlockConnectors>
				<BlockConnector connector-kind="plug" connector-type="number" position-type="mirror"></BlockConnector>
			</BlockConnectors>
			<LangSpecProperties>
				<LangSpecProperty key="vm-cmd-name" value="eval-num"></LangSpecProperty>
				<LangSpecProperty key="is-monitorable" value="yes"></LangSpecProperty>
			</LangSpecProperties>
		</BlockGenus>

		<BlockGenus name="string" kind="data" initlabel="abc" editable-label="yes" is-label-value="yes" color="255 0 255">
			<description>
				<text>
					Reports the text shown.
				</text>
			</description>
			<BlockConnectors>
				<BlockConnector connector-kind="plug" connector-type="string" position-type="mirror"></BlockConnector>		
			</BlockConnectors>
			<LangSpecProperties>
				<LangSpecProperty key="vm-cmd-name" value="eval-num"></LangSpecProperty>
				<LangSpecProperty key="is-monitorable" value="yes"></LangSpecProperty>
			</LangSpecProperties>
		</BlockGenus>

		<BlockGenus name="true" kind="data" initlabel="true" color="255 0 255">
			<description>
				<text>
					Reports the boolean true.
				</text>
			</description>
			<BlockConnectors>
				<BlockConnector connector-kind="plug" connector-type="boolean" position-type="mirror"></BlockConnector>
			</BlockConnectors>
			<LangSpecProperties>
				<LangSpecProperty key="vm-cmd-name" value="true"></LangSpecProperty>
				<LangSpecProperty key="is-monitorable" value="yes"></LangSpecProperty>
			</LangSpecProperties>
		</BlockGenus>

		<BlockGenus name="false" kind="data" initlabel="false" color="255 0 255">
			<description>
				<text>
					Reports the boolean false.
				</text>
			</description>
			<BlockConnectors>
				<BlockConnector connector-kind="plug" connector-type="boolean" position-type="mirror"></BlockConnector>
			</BlockConnectors>
			<LangSpecProperties>
				<LangSpecProperty key="vm-cmd-name" value="false"></LangSpecProperty>
				<LangSpecProperty key="is-monitorable" value="yes"></LangSpecProperty>
			</LangSpecProperties>
		</BlockGenus>

		<!-- COLORS -->

		<BlockGenus name="random-color" kind="function" initlabel="random color" color="27 180 225">
			<description>
				<text>
					Selects a random color.
				</text>
			</description>
			<BlockConnectors>
				<BlockConnector connector-kind="plug" connector-type="number" position-type="mirror"></BlockConnector>
			</BlockConnectors>
			<LangSpecProperties>
				<LangSpecProperty key="vm-cmd-name" value="random-color"></LangSpecProperty>
			</LangSpecProperties>
		</BlockGenus>

		<BlockGenus name="red" kind="data" initlabel="red" color="255 0 0">
			<BlockConnectors>
				<BlockConnector connector-kind="plug" connector-type="number" position-type="mirror"></BlockConnector>
			</BlockConnectors>
			<LangSpecProperties>
				<LangSpecProperty key="vm-cmd-name" value="eval-num"></LangSpecProperty>
				<LangSpecProperty key="special-value" value="15"></LangSpecProperty>
			</LangSpecProperties>
		</BlockGenus>

		<BlockGenus name="black" kind="data" initlabel="black" color="0 0 0">
			<BlockConnectors>
				<BlockConnector connector-kind="plug" connector-type="number" position-type="mirror"></BlockConnector>
			</BlockConnectors>
			<LangSpecProperties>
				<LangSpecProperty key="vm-cmd-name" value="eval-num"></LangSpecProperty>
				<LangSpecProperty key="special-value" value="0"></LangSpecProperty>
			</LangSpecProperties>
		</BlockGenus>

		<BlockGenus name="white" kind="data" initlabel="white" color="255 255 255">
			<BlockConnectors>
				<BlockConnector connector-kind="plug" connector-type="number" position-type="mirror"></BlockConnector>
			</BlockConnectors>
			<LangSpecProperties>
				<LangSpecProperty key="vm-cmd-name" value="eval-num"></LangSpecProperty>
				<LangSpecProperty key="special-value" value="9"></LangSpecProperty>
			</LangSpecProperties>
		</BlockGenus>

		<BlockGenus name="gray" kind="data" initlabel="gray" color="128 128 128">
			<BlockConnectors>
				<BlockConnector connector-kind="plug" connector-type="number" position-type="mirror"></BlockConnector>
			</BlockConnectors>
			<LangSpecProperties>
				<LangSpecProperty key="vm-cmd-name" value="eval-num"></LangSpecProperty>
				<LangSpecProperty key="special-value" value="5"></LangSpecProperty>
			</LangSpecProperties>
		</BlockGenus>

		<BlockGenus name="orange" kind="data" initlabel="orange" color="255 165 0">
			<BlockConnectors>
				<BlockConnector connector-kind="plug" connector-type="number" position-type="mirror"></BlockConnector>
			</BlockConnectors>
			<LangSpecProperties>
				<LangSpecProperty key="vm-cmd-name" value="eval-num"></LangSpecProperty>
				<LangSpecProperty key="special-value" value="25"></LangSpecProperty>
			</LangSpecProperties>
		</BlockGenus>

		<BlockGenus name="brown" kind="data" initlabel="brown" color="165 42 42">
			<BlockConnectors>
				<BlockConnector connector-kind="plug" connector-type="number" position-type="mirror"></BlockConnector>
			</BlockConnectors>
			<LangSpecProperties>
				<LangSpecProperty key="vm-cmd-name" value="eval-num"></LangSpecProperty>
				<LangSpecProperty key="special-value" value="35"></LangSpecProperty>
			</LangSpecProperties>
		</BlockGenus>

		<BlockGenus name="yellow" kind="data" initlabel="yellow" color="255 255 0">
			<BlockConnectors>
				<BlockConnector connector-kind="plug" connector-type="number" position-type="mirror"></BlockConnector>
			</BlockConnectors>
			<LangSpecProperties>
				<LangSpecProperty key="vm-cmd-name" value="eval-num"></LangSpecProperty>
				<LangSpecProperty key="special-value" value="45"></LangSpecProperty>
			</LangSpecProperties>
		</BlockGenus>